{
  "weid": "did:weid:101:0xce618fb7fbacaf6398a0b4b78bf2dd942c8c49c7",
  "name": "did:weid:101:0xce618fb7fbacaf6398a0b4b78bf2dd942c8c49c7did:weid:101:0xce618fb7fbacaf6398a0b4b78bf2dd942c8c49c7did:weid:101:0xce618fb7fbacaf6398a0b4b78bf2dd942c8c49c7did:weid:101:0xce618fb7fbacaf6398a0b4b78bf2dd942c8c49c7did:weid:101:0xce618fb7fbacaf6398a0b4b78bf2dd942c8c49c7did:weid:101:0xce618fb7fbacaf6398a0b4b78bf2dd942c8c49c7",
  "gender": "M",
  "age":26
}